{
  "boundaryId": "sha256:boundary:v1:39d9235ad09ee5b826c71d8112d207bb872c431c3015cf30e25541669263f402",
  "executionState": "pending",
  "identities": {
    "authority": "sha256:authority:v1:6666666666666666666666666666666666666666666666666666666666666666",
    "baseline": "sha256:baseline:v1:1111111111111111111111111111111111111111111111111111111111111111",
    "configuration": "sha256:configuration:v1:2222222222222222222222222222222222222222222222222222222222222222",
    "intent": "sha256:intent:v1:5555555555555555555555555555555555555555555555555555555555555555",
    "obligation": "sha256:obligation:v1:7777777777777777777777777777777777777777777777777777777777777777",
    "state": "sha256:state:v1:4444444444444444444444444444444444444444444444444444444444444444",
    "subject": "sha256:subject:v1:8888888888888888888888888888888888888888888888888888888888888888",
    "validator": "sha256:validator:v1:3333333333333333333333333333333333333333333333333333333333333333"
  },
  "limitations": [],
  "normalizationVersion": "1",
  "responsibility": "Verify Issue #65 candidate",
  "schema": "collab/boundary-descriptor/v1",
  "scope": [
    "collab",
    "schemas"
  ]
}
